title,link,upvotes
Why does Lex support AI? Is he stupid?,https://www.reddit.com/r/BatmanArkham/comments/1pakgh7/why_does_lex_support_ai_is_he_stupid/,
Serious question: Do you think I (first image) could get a girl like this (second image)?,https://www.reddit.com/r/BatmanArkham/comments/1pd3g5m/serious_question_do_you_think_i_first_image_could/,
Is there a lore reason why she did this?,https://www.reddit.com/r/BatmanArkham/comments/1p7fac1/is_there_a_lore_reason_why_she_did_this/,
"Fuck it, the Minecraft movie in 3 minutes",https://www.reddit.com/r/BatmanArkham/comments/1pcp10d/fuck_it_the_minecraft_movie_in_3_minutes/,
Why is Mikey doing this does he like it?,https://www.reddit.com/r/BatmanArkham/comments/1pdcj2e/why_is_mikey_doing_this_does_he_like_it/,
Why is -man getting vaccinated? Is he precautious?,https://www.reddit.com/r/BatmanArkham/comments/1p8pfr5/why_is_man_getting_vaccinated_is_he_precautious/,
Early Jonk sighting,https://www.reddit.com/r/BatmanArkham/comments/1pcuge4/early_jonk_sighting/,
Zoological 2,https://www.reddit.com/r/BatmanArkham/comments/1p8ubu1/zoological_2/,
"chat, what would you do in this situation chat",https://www.reddit.com/r/BatmanArkham/comments/1pd3rrd/chat_what_would_you_do_in_this_situation_chat/,
What did Spotify mean by this? Are they stupid?,https://www.reddit.com/r/BatmanArkham/comments/1pdmw65/what_did_spotify_mean_by_this_are_they_stupid/,
Can you replay Harley Quinn's revenge?,https://www.reddit.com/r/BatmanArkham/comments/1pdmk4w/can_you_replay_harley_quinns_revenge/,
James Gunn is a..... I just can't prove it yet...,https://www.reddit.com/r/BatmanArkham/comments/1ov496h/james_gunn_is_a_i_just_cant_prove_it_yet/,
Serious question: Do you think I (first photo) could date a girl like this (second photo),https://www.reddit.com/r/BatmanArkham/comments/1pd9cyj/serious_question_do_you_think_i_first_photo_could/,
Serious question: do you think I (second photo) could get a guy like this one (first photo),https://www.reddit.com/r/BatmanArkham/comments/1pcn6pd/serious_question_do_you_think_i_second_photo/,
Are the alsume mods hypocrites?,https://www.reddit.com/r/BatmanArkham/comments/1pdma6z/are_the_alsume_mods_hypocrites/,
Is there a lore reason why the r/art mods are kinda dicks?,https://www.reddit.com/r/BatmanArkham/comments/1p7l7ns/is_there_a_lore_reason_why_the_rart_mods_are/,
Is this sub even about Batman Arkham💔,https://www.reddit.com/r/BatmanArkham/comments/1pcvu99/is_this_sub_even_about_batman_arkham/,
Why Did The Jonkler Jonkle The Rat is he Evil ?,https://www.reddit.com/r/BatmanArkham/comments/1p7tp7n/why_did_the_jonkler_jonkle_the_rat_is_he_evil/,
Is it just me or does this shot composition make a clown face,https://www.reddit.com/r/BatmanArkham/comments/1p53ia1/is_it_just_me_or_does_this_shot_composition_make/,
Killer frost cosplay (ticosplays),https://www.reddit.com/r/BatmanArkham/comments/1pb2l77/killer_frost_cosplay_ticosplays/,
"""You won't last 20 seconds playing this game""",https://www.reddit.com/r/BatmanArkham/comments/1p1c093/you_wont_last_20_seconds_playing_this_game/,
Is there a lore reason behind this ?,https://www.reddit.com/r/BatmanArkham/comments/1pbf77p/is_there_a_lore_reason_behind_this/,
Zootopia 2 is NOW PLAYING only in theaters!,https://www.reddit.com/r/BatmanArkham/comments/1p7y88x/zootopia_2_is_now_playing_only_in_theaters/,
What would be his fucking aslum name?,https://www.reddit.com/r/BatmanArkham/comments/1pdm3bu/what_would_be_his_fucking_aslum_name/,
What the FLIP is this creature? Why does he love me? Is he friend?,https://www.reddit.com/r/BatmanArkham/comments/1pd20xk/what_the_flip_is_this_creature_why_does_he_love/,
"This post, this singular piece of reddit history re-defined this whole sub-reddit into arkham asylum itself.",https://www.reddit.com/r/BatmanArkham/comments/1p7sfxh/this_post_this_singular_piece_of_reddit_history/,
"Jut created this new character, what the fuck do I name them",https://www.reddit.com/r/BatmanArkham/comments/1pdlkpn/jut_created_this_new_character_what_the_fuck_do_i/,
"Does anybody remember Jimmybert, the comic relief in the Batman Arkham trilogy? he was my favourite, i wished they used him more",https://www.reddit.com/r/BatmanArkham/comments/1pd0z47/does_anybody_remember_jimmybert_the_comic_relief/,
Here is the whole Arkham story in chronological order.,https://www.reddit.com/r/BatmanArkham/comments/1pdktmp/here_is_the_whole_arkham_story_in_chronological/,
Why would nom do that to the thong? Is he mean?,https://www.reddit.com/r/BatmanArkham/comments/1pdkoih/why_would_nom_do_that_to_the_thong_is_he_mean/,
Zootopia 2 is an absolute blast! See it NOW only in theaters,https://www.reddit.com/r/BatmanArkham/comments/1p86ne1/zootopia_2_is_an_absolute_blast_see_it_now_only/,
Sonars new job...,https://www.reddit.com/r/BatmanArkham/comments/1owttyi/sonars_new_job/,
Why does the bot want my seed is it a farmer?,https://www.reddit.com/r/BatmanArkham/comments/1pdkhsz/why_does_the_bot_want_my_seed_is_it_a_farmer/,
Ask me a question and I might answer it if I feel like it,https://www.reddit.com/r/BatmanArkham/comments/1pdkbvh/ask_me_a_question_and_i_might_answer_it_if_i_feel/,
Serious question: do you think I (on the left) will ever beat him (on the right)?,https://www.reddit.com/r/BatmanArkham/comments/1pd8r0c/serious_question_do_you_think_i_on_the_left_will/,
"Looks familiar, doesn't it?",https://www.reddit.com/r/BatmanArkham/comments/1oy48sn/looks_familiar_doesnt_it/,
Man failed to save them 😔,https://www.reddit.com/r/BatmanArkham/comments/1pbxlbf/man_failed_to_save_them/,
Serious question: do you think I (the first photo) could get a girl this one (second photo)?,https://www.reddit.com/r/BatmanArkham/comments/1pcpiv8/serious_question_do_you_think_i_the_first_photo/,
why are we turning the cis into trans in my biology lesson? is biology woke?,https://www.reddit.com/r/BatmanArkham/comments/1pdjqaa/why_are_we_turning_the_cis_into_trans_in_my/,
"yeah, I’m bat",https://www.reddit.com/r/BatmanArkham/comments/1pd4rwt/yeah_im_bat/,27K
Why did Jonkler do this? Is he evil?,https://www.reddit.com/r/BatmanArkham/comments/1pa96hs/why_did_jonkler_do_this_is_he_evil/,
...wh-why... why didn't he...,https://www.reddit.com/r/BatmanArkham/comments/1ortr2r/whwhy_why_didnt_he/,
Officer Balls reporting for doody.,https://www.reddit.com/r/BatmanArkham/comments/1ovim42/officer_balls_reporting_for_doody/,
What even is the point of this sub anymore? (humour welcome),https://www.reddit.com/r/BatmanArkham/comments/1pd0luw/what_even_is_the_point_of_this_sub_anymore_humour/,
Imagine Braniac having sex in Man of tomorrow and start morbing on Soup,https://www.reddit.com/r/BatmanArkham/comments/1pd3u2e/imagine_braniac_having_sex_in_man_of_tomorrow_and/,
.,https://www.reddit.com/r/BatmanArkham/comments/1pcohx7/_/,
"Justice league fancast, thoughts?",https://www.reddit.com/r/BatmanArkham/comments/1ot9k8b/justice_league_fancast_thoughts/,
What the ABSOLUTE FUCK happened here?,https://www.reddit.com/r/BatmanArkham/comments/1op7e6r/what_the_absolute_fuck_happened_here/,
Is Marvel Stupid?,https://www.reddit.com/r/BatmanArkham/comments/1p6aga1/is_marvel_stupid/,
JUST MADE ANOTHER FUCKING NEW CHARACTER WHAT THE FUCK SHOULD BE HIS FATE,https://www.reddit.com/r/BatmanArkham/comments/1pdjp21/just_made_another_fucking_new_character_what_the/,
