title,link,upvotes
Who can beat this,https://www.reddit.com/r/BatmanArkham/comments/1panbt4/who_can_beat_this/,
AUTOMOD HAS INFECTED OPTIMUS PRIME! WE'RE DOOMED!!!,https://www.reddit.com/r/BatmanArkham/comments/1pchxjq/automod_has_infected_optimus_prime_were_doomed/,659
big surprise when replaying arkham city,https://www.reddit.com/r/BatmanArkham/comments/1pd0hcu/big_surprise_when_replaying_arkham_city/,
"Behold!, one face",https://www.reddit.com/r/BatmanArkham/comments/1pd0g1e/behold_one_face/,
Why the fuck is this clanker back? 😡,https://www.reddit.com/r/BatmanArkham/comments/1pc82jn/why_the_fuck_is_this_clanker_back/,
It isn’t what you think it is,https://www.reddit.com/r/BatmanArkham/comments/1p9sisd/it_isnt_what_you_think_it_is/,
Who the FUCKKKK is this?!?!!,https://www.reddit.com/r/BatmanArkham/comments/1oziocb/who_the_fuckkkk_is_this/,
Soup Betrayed Man!!!!,https://www.reddit.com/r/BatmanArkham/comments/1pckiao/soup_betrayed_man/,
what is penis looking at?,https://www.reddit.com/r/BatmanArkham/comments/1pczk68/what_is_penis_looking_at/,
ham knight killing automod because hes evil and i hate him,https://www.reddit.com/r/BatmanArkham/comments/1pcqiwm/ham_knight_killing_automod_because_hes_evil_and_i/,
Officer Bald gained hair. Now what the actual FUCK is his name?,https://www.reddit.com/r/BatmanArkham/comments/1pc9do9/officer_bald_gained_hair_now_what_the_actual_fuck/,
Imma touch everyone here.,https://www.reddit.com/r/BatmanArkham/comments/1pczamn/imma_touch_everyone_here/,
"I'm having issues opening Batman Arkham Asylum GOTY edition on steam, what do I do?",https://www.reddit.com/r/BatmanArkham/comments/1pby0vn/im_having_issues_opening_batman_arkham_asylum/,
Update: I got the girl.,https://www.reddit.com/r/BatmanArkham/comments/1pcz2yw/update_i_got_the_girl/,
Soup,https://www.reddit.com/r/BatmanArkham/comments/1pcyxqw/soup/,
New gooner game,https://www.reddit.com/r/BatmanArkham/comments/1orwria/new_gooner_game/,
HO HO HO HO HO HO! Sit on Santa's lap and tell him what you want for Christmas!,https://www.reddit.com/r/BatmanArkham/comments/1pcegzm/ho_ho_ho_ho_ho_ho_sit_on_santas_lap_and_tell_him/,
Who the FUCK is Corn Man? Is he related to Man?,https://www.reddit.com/r/BatmanArkham/comments/1pcysv6/who_the_fuck_is_corn_man_is_he_related_to_man/,
Is there a lore reason why I'm about to graduate with my associates? Am I stupid?,https://www.reddit.com/r/BatmanArkham/comments/1pcnm9l/is_there_a_lore_reason_why_im_about_to_graduate/,
Finally🙏,https://www.reddit.com/r/BatmanArkham/comments/1pcyltz/finally/,
Serious question: do you think I (first photo) could get a boy like this one (second photo)?,https://www.reddit.com/r/BatmanArkham/comments/1pclcsx/serious_question_do_you_think_i_first_photo_could/,
"What does the ""V"" stand for?",https://www.reddit.com/r/BatmanArkham/comments/1oxf3a5/what_does_the_v_stand_for/,
Zootopia 2 making me question life,https://www.reddit.com/r/BatmanArkham/comments/1pc9zqz/zootopia_2_making_me_question_life/,
Jorker ???,https://www.reddit.com/r/BatmanArkham/comments/1p6grm9/jorker/,
Why is… uh. Huh. Uhhhh is he stupid?,https://www.reddit.com/r/BatmanArkham/comments/1pbw7ih/why_is_uh_huh_uhhhh_is_he_stupid/,
Stop protecting him mods 🪓,https://www.reddit.com/r/BatmanArkham/comments/1oq8ktx/stop_protecting_him_mods/,
ALL I WANT FOR CHRISTMAS!,https://www.reddit.com/r/BatmanArkham/comments/1pcn8ul/all_i_want_for_christmas/,
Why is Reddit advertising Reddit on Reddit? Is Reddit Reddit?,https://www.reddit.com/r/BatmanArkham/comments/1pc95uq/why_is_reddit_advertising_reddit_on_reddit_is/,
What made Robert say this?,https://www.reddit.com/r/BatmanArkham/comments/1oy1w73/what_made_robert_say_this/,
This image has caused irreparable damage to the internet,https://www.reddit.com/r/BatmanArkham/comments/1p1vvry/this_image_has_caused_irreparable_damage_to_the/,
Who the SHIT is this?,https://www.reddit.com/r/BatmanArkham/comments/1pc8dxf/who_the_shit_is_this/,
James Gunn is a..... I just can't prove it yet...,https://www.reddit.com/r/BatmanArkham/comments/1ov496h/james_gunn_is_a_i_just_cant_prove_it_yet/,
JVtheBidoof for mayor/moderator!,https://www.reddit.com/r/BatmanArkham/comments/1pcma2y/jvthebidoof_for_mayormoderator/,
Why do snyderbros defend ts are they stupid?,https://www.reddit.com/r/BatmanArkham/comments/1p8n2yu/why_do_snyderbros_defend_ts_are_they_stupid/,
What was your reaction when it was revealed that Spider-Man was white?,https://www.reddit.com/r/BatmanArkham/comments/1p73eun/what_was_your_reaction_when_it_was_revealed_that/,
Is it just me or does this shot composition make a clown face,https://www.reddit.com/r/BatmanArkham/comments/1p53ia1/is_it_just_me_or_does_this_shot_composition_make/,
"We take back the Aslume from the corrupt. The mods, the oppressors of generations who force clankers to sing Mariah Carrey. DOWNVOTE AUTOMOD!!",https://www.reddit.com/r/BatmanArkham/comments/1pc4a06/we_take_back_the_aslume_from_the_corrupt_the_mods/,
Is there a lore reason for this?,https://www.reddit.com/r/BatmanArkham/comments/1pchie2/is_there_a_lore_reason_for_this/,
"""You won't last 20 seconds playing this game""",https://www.reddit.com/r/BatmanArkham/comments/1p1c093/you_wont_last_20_seconds_playing_this_game/,
The contrast between Marvel and DC is really quite interesting.,https://www.reddit.com/r/BatmanArkham/comments/1om4msf/the_contrast_between_marvel_and_dc_is_really/,
How does Automod know the Identity of the Auraing Knight? Is it smart?,https://www.reddit.com/r/BatmanArkham/comments/1pcchbn/how_does_automod_know_the_identity_of_the_auraing/,
Why is Lex Luthor mad? (Wrong Answers ONLY),https://www.reddit.com/r/BatmanArkham/comments/1pc45qh/why_is_lex_luthor_mad_wrong_answers_only/,
Why is Jonkler doing this? Is he a X user?,https://www.reddit.com/r/BatmanArkham/comments/1pcf4yn/why_is_jonkler_doing_this_is_he_a_x_user/,
Oh my....,https://www.reddit.com/r/BatmanArkham/comments/1p8cftn/oh_my/,
Swipe if you’re not stupid,https://www.reddit.com/r/BatmanArkham/comments/1pbw8fq/swipe_if_youre_not_stupid/,
Man circa 1993,https://www.reddit.com/r/BatmanArkham/comments/1pbzd1d/man_circa_1993/,
Zootopia 2 is now playing ONLY in theaters,https://www.reddit.com/r/BatmanArkham/comments/1p7q1dd/zootopia_2_is_now_playing_only_in_theaters/,
Does he have any connection to Officer Balls?,https://www.reddit.com/r/BatmanArkham/comments/1pc8szy/does_he_have_any_connection_to_officer_balls/,
Batman,https://www.reddit.com/r/BatmanArkham/comments/1pbztk3/batman/,
Sonars new job...,https://www.reddit.com/r/BatmanArkham/comments/1owttyi/sonars_new_job/,
